gate_id,gate,result,blocking,evidence,notes
DF03-G01,Funding rate semantics: Binance calc_time unclassified; OKX fundingTime settlement semantics pass only for accepted scope,FAIL_PARTIAL,Yes,"DF-03-E07 (FUND-002 report), DF-03-E11 (FUND-003 report)","Binance archive fields are `calc_time`, `funding_interval_hours`, `last_funding_rate` (matched against REST `fundingRate`/`fundingTime`, not relabeled); `calc_time` classification remains incomplete. OKX `fundingTime` settlement semantics pass only for its accepted scope. Partial; blocking."
DF03-G02,Rate unit/sign/formula: Binance rate unit/sign/formula fail; OKX predicted-vs-realized distinction partial,FAIL_PARTIAL,Yes,"DF-03-E07 (FUND-002 report), DF-03-E11 (FUND-003 report)","Binance archive rate field `last_funding_rate` (not relabeled as `fundingRate`) unit/sign/formula fail (not a normalized, position-dependent cashflow). OKX archive predicted-vs-realized distinction remains partial. Partial; blocking."
DF03-G03,Interval/formula history: incompletely versioned; observed intervals do not establish historical rules,FAIL_PARTIAL,Yes,"DF-03-E07 (FUND-002 report), DF-03-E11 (FUND-003 report), DF-03-E02 (RD-02)",Funding interval and formula history are incompletely versioned; observed intervals do not establish historical rules. Partial; blocking.
DF03-G04,"Historical availability: Binance partial; OKX only conservative 2026 bound, not historical publication-time authority",FAIL_PARTIAL,Yes,"DF-03-E07 (FUND-002 report), DF-03-E11 (FUND-003 report)","Binance historical funding availability remains partial; OKX has only a conservative 2026 bound, not historical publication-time authority. Partial; blocking."
DF03-G05,Replacement/correction history: funding-specific replacement/correction history not established,FAIL_UNKNOWN,Yes,DF-03-E07/E11 (semantics reports),Funding-specific replacement/correction history is not established from retained evidence. Blocking.
DF03-G06,Raw lineage: Binance raw lineage passes bounded samples; OKX full request identity fails,FAIL_PARTIAL,Yes,"DF-03-E07 (FUND-002 report), DF-03-E11 (FUND-003 report)",Binance raw funding lineage passes its bounded samples; OKX full request identity fails (request identity not fully retained). Partial; blocking.
DF03-G07,Licensing: intended internal acquisition/retention licensing unestablished or ambiguous,FAIL_UNKNOWN,Yes,"DF-03-E07/E08 (Binance report + matrix, licensing gate); DF-03-E11/E12 (OKX report + matrix, licensing gate); DF-03-E06/E09/E10/E13 (tickets/acceptances establish final status, not primary legal-semantics evidence)",Intended internal acquisition/retention licensing remains unestablished or ambiguous (Binance E07/E08; OKX E11/E12). Tickets/acceptances record final status but are not the primary legal-semantics evidence. Blocking.
DF03-G08,Cashflow conversion: funding-rate events are not position-dependent cashflows; inputs absent; FX does not authorize USD conversion,FAIL_BLOCKED,Yes,DF-03-E03/E04/E05 (FUND-001 funding-event vs position-dependent realized-cashflow separation); DF-03-E07/E11 (provider funding-rate-event evidence); DF-03-E14/E15/E16 (FX-003 no-primary-authority boundary),"Provider funding-rate events are not position-dependent realized cashflows (FUND-001 E03/E04/E05). Required notional/side/mark/index inputs are absent (provider rate-event evidence E07/E11), and accepted FX-003 evidence (E14/E15/E16) does not authorize USD conversion. Hard blocker; blocking."
