decision_id,factor_or_requirement,source_decision,linked_sprint002_ref,determination,next_action
RD-01,MOM-01 realistic-momentum diagnostics (LIT-038),ACCEPT exchange market data (SRC-001..SRC-006),"DF-03; DF-06","Exchange trades/klines/funding reachable; mark-to-market, margin/liquidation paths, long/short legs auditable from market data. Momentum diagnostics feasible.","Build point-in-time trade/kline backfill with retrieval-timestamped objects."
RD-02,CARRY-01 funding leg,SRC-003 OKX/Bybit funding; SRC-005/SRC-006,DF-03,"Funding history reachable with fundingTime + formulaType/interval. Perp funding implementable.","Capture fundingInterval/formulaType per timestamp; reconcile CEX vs DEX fragmentation (LIT-037)."
RD-03,CARRY-01 staking leg,SRC-008 DefiLlama + SRC-012 on-chain,DF-05,"Staking-yield histories require on-chain/DefiLlama + provider (StakingRewards used by Cong/He/Tang). Not fully audited.","Procure on-chain/DefiLlama; trial staking-yield reconstruction."
RD-04,DIL-01 token dilution/unlock,SRC-010 Tokenomist DEFER; SRC-008 emissions CONDITIONAL; SRC-012 on-chain CONDITIONAL,DF-01; DF-02; DF-10,"BLOCKED: Tokenomist unreachable; vintage preservation unconfirmed; on-chain vesting not queried. DIL-01 remains DEFERRED/UNTESTED.","Establish reachable unlock source with proven vintage preservation; query on-chain vesting directly."
RD-05,NET-01 network/activity,SRC-007 Coin Metrics (AdrActCnt available BTC 2009 / SUSHI 2020); SRC-012 on-chain CONDITIONAL,DF-07,"Coin Metrics active-address series reachable (availability ranges confirmed); but issued!=float and smaller-asset coverage varies. NET-01 remains DEFERRED pending on-chain publication-time audit.","Audit publication-time vs block-time for on-chain metrics; confirm revision handling."
RD-06,survivorship-free universe (DF-08),SRC-001..SRC-006 + announcements,DF-08,"Listing/delivery reconstructable via instruments-info + market-data edges (CONFIRMED_MARKET_DATA). Delisting needs polling + announcement cross-check.","Implement instrument master with launchTime/deliveryTime/state and last-trade polling."
RD-07,hidden-factor / controls,SRC-007 + SRC-001..SRC-006,"RD-07 (Sprint 002)","All factor inputs feasible from accepted sources; controls runnable once backfill exists.","No blocker; depends on RD-01..RD-05 data landing."
RD-08,bulk backfill strategy,SRC-002 CONDITIONAL,"DF-01..DF-10","Bulk zip unreachable here; REST pagination acceptable for bounded backfill. If bulk reachable later, verify provider checksums.","Trial REST backfill; revisit bulk if host path resolves."
