gate_id,gate,result,blocking,evidence,notes
DF01-G01,"Semantic: SplyCur is issued supply, not circulating float",FAIL_SEMANTIC,Yes,"DF-01-E04 (schema/semantics audit: SplyCur issued supply field), DF-01-E10 (Coin Metrics source note)","The Coin Metrics Community field `SplyCur` represents issued/current supply, not circulating float. Historically authoritative circulating supply requires float-adjusted methodology that is not present in the retained evidence. Semantic failure: the retained field cannot serve as circulating supply. Blocking."
DF01-G02,"Coverage: BTC/SUSHI observed; BONK/micro-cap Community absent",FAIL_PARTIAL,Yes,"DF-01-E03 (source object inventory), DF-01-E02 (source decision register)","BTC and SUSHI observations exist in the accepted inventory, but BONK and broader micro-cap Community coverage are absent. Coverage is partial and cannot support a general PIT supply universe. Blocking."
DF01-G03,"Time semantics: publication/known-time lag unbounded",FAIL_UNKNOWN,Yes,"DF-01-E03 (inventory), DF-01-E05 (correction/revision audit)","No retained record bounds the lag between on-chain event time and Coin Metrics publication/known-time. Without a bounded lag, point-in-time correctness cannot be asserted. Blocking."
DF01-G04,"Revision: server-side revisions/backfills exist, retained vintages absent",FAIL_UNKNOWN,Yes,"DF-01-E05 (correction/revision audit), DF-01-E08 (evidence reconciliation), DF-01-E09 (hash verification)","Server-side revisions and backfills exist, but no historical vintages of the data are retained in the repository. Past-value reproducibility is NOT demonstrated from the repository-retained evidence (it is not claimed to be universally impossible). Blocking."
DF01-G05,"Provenance: request identities/observations recorded; original raw bodies not retained",FAIL_PARTIAL,Yes,"DF-01-E03 (inventory records request URLs, retrieval/status, observations; E08/E09 record accepted hashes), DF-01-E10 (source note)","E03 records request URLs, retrieval/status facts, and observations; E08/E09 record the accepted hashes. E03 does not contain a hash for every timeseries request. The original raw API response bodies are NOT repository-retained. Provenance is partial: we can verify the accepted artifacts, not the original responses. Blocking."
DF01-G06,"Licensing: licensing and internal raw-retention authority not established",FAIL_UNKNOWN,Yes,"DF-01-E10 (Coin Metrics source note), DF-01-E07 (research lead decisions)","The accepted evidence establishes no licensing grant nor internal raw-retention authority for Coin Metrics Community data. Authority to retain/use raw snapshots is unproven. Blocking."
DF01-G07,"Reproducibility: no contemporaneously published historical value reproduced",FAIL_UNKNOWN,Yes,"DF-01-E06 (research data decisions), DF-01-E08 (reconciliation)","No contemporaneously published historical supply value was reproduced from retained artifacts; the original bodies needed to reproduce are absent (see G05). Blocking."
DF01-G08,"Semantic: max/future-unissued supply absent from retained DF-01 evidence",FAIL_SEMANTIC,Yes,"DF-01-E03 (inventory lacks max/future supply), DF-01-E04 (schema lacks unissued fields)","Max/future-unissued supply series are absent from the retained DF-01 evidence, so FDV and the required denominator history for supply-dependent metrics cannot be constructed from it (the provider is not claimed to universally lack such series). Semantic failure. Blocking."
