gate_id,gate,result,blocking,evidence,notes
FX003-G01,USD-per-USDT direction,PASS,No,"FX003-R01B (inflated CSV); R02B filename master_q4/USDTUSD_1440.csv","Pair USDTUSD = USD per USDT. Col4 (close) first row 0.9991, last 0.99848. Direction explicit in filename + close column; no ambiguity. PASS."
FX003-G02,historical depth + May-2022 depeg coverage,PASS,No,"FX003-R01B rows 3200; 2017-03-29 to 2025-12-31; May 12 2022 O=.9953 H=.9989 L=.92 C=.9971","Headerless CSV, 3,200 daily (24h) rows spanning 2017-03-29 through 2025-12-31. May-12-2022 depeg bar present with low 0.92. Full depeg window covered at daily resolution. PASS."
FX003-G03,bar timestamp semantics,FAIL_PARTIAL,Yes,"FX003-R01B col0 Unix seconds; first 1490745600 = 2017-03-29 00:00:00 UTC","Bars are 24h aligned to 00:00:00 UTC; col0 = bar open time. BUT no header row and no explicit tz/session documentation in the archive; bar-time-as-publication-time ambiguity not fully resolved. FAIL-PARTIAL."
FX003-G04,publication/acquisition/availability times,FAIL_PARTIAL,Yes,"FX003-R01H/R02H/R03H/R04H Last-Modified 2026-01-24; R05H view no LM; R06H LM 2026-07-21; R08H LM 2026-07-21","Last-Modified (2026-01-24) is the object date, not data-end (2025-12-31) and not bar time. View page has no Last-Modified; support/terms pages have their own (2026-07-21). Point-in-time availability of historical rows cannot be pinned to a publication date. FAIL-PARTIAL."
FX003-G05,archive vintages + correction/replacement behavior,FAIL_PARTIAL,Yes,"FX003-R03B central dir; FX003-R07B quarters Q1-2023..Q1-2026","Central directory captured; quarterly folder lists Q1-2023 through Q1-2026. No published correction/replacement policy for the bulk archive. ZIP CRC proves current-member bytes only, not historical immutability or vintage history. FAIL-PARTIAL."
FX003-G06,current-byte / member integrity,PASS,No,"FX003-R01B CRC-32 0x32280a6e = R03B central dir; comp 76401 / uncomp 201200 match; inflated SHA 9dafa48...","Member integrity verified: CRC-32, compressed and uncompressed sizes all match central directory; inflated SHA-256 computed. Complete-archive SHA-256 not captured (ranged member only) but member-level integrity is sound. PASS."
FX003-G07,internal acquisition / metadata-retention permission,FAIL_CONFLICT,Yes,"FX003-R06B support page (use in code/conversion); FX003-R08B EEA Terms (restrict copying/automated extraction)","CONFLICT: support article states data 'can be viewed in a text editor, used in code, converted into other formats'; EEA Terms restrict copying and automated extraction with no explicit bulk-redistribution grant. Unresolved conflict => fail-closed. FAIL-CONFLICT."
FX003-G08,exact reproducible raw lineage,FAIL_PARTIAL,Yes,"FX003-R01H/R02H/R03H/R04H content-range bytes + statuses; FX003-R05B warning/confirmation flow","Member extracted via ranged GET with exact byte ranges and HTTP 206 + retained headers/bodies; Google Drive warning/confirmation (virus-scan) flow captured (R05B). Whole-archive byte-range/SHA not captured (ZIP64 offset=0xFFFFFFFF). Do NOT treat a ranged member as the complete-archive SHA-256. FAIL-PARTIAL."
