gate_id,gate,result,blocking,evidence,notes
FX003-G01,USD-per-USDT direction,PASS,No,"FX003-R01B (inflated CSV); R02B filename master_q4/USDTUSD_1440.csv","Pair USDTUSD = USD per USDT. Col4 (close) first row 0.999, last 0.99848. Direction is explicit in filename + close column; no ambiguity. PASS."
FX003-G02,historical depth + May-2022 depeg coverage,FAIL_PARTIAL,Yes,"FX003-R01B rows 3199; depeg window 7 daily rows (closes 0.9953-0.9997)","Depth: 2017-03-30 to 2025-12-31 daily = 9y coverage, good. Depeg: May 9-15 2022 window present (7 daily bars) but the intraday sub-$0.95 trough is NOT resolvable at 1440-min (daily) resolution. Event depth under-resolved. FAIL-PARTIAL."
FX003-G03,bar timestamp semantics,PASS,No,"FX003-R01B col0 Unix seconds; 1490832000 = 2017-03-30 00:00:00 UTC","Bars are daily aligned to 00:00:00 UTC; col0 is bar open time (Unix seconds). Semantics clear. PASS. Do NOT treat bar time as publication time."
FX003-G04,publication/acquisition/availability times,PASS_WITH_LIMIT,No,"FX003-R01H/R03H/R04H Last-Modified 2026-01-24; captures 2026-07-21; HTTP 206","Last-Modified is the object date (2026-01-24), not the data end (2025-12-31) and not bar time. Archive availability confirmed via Google Drive; no claim of 2017 availability. PASS within this limitation."
FX003-G05,archive vintages + correction/replacement behavior,FAIL_UNKNOWN,Yes,"FX003-R03B 24056 members; no documented correction policy","Central directory shows 24056 members; only 1 member captured. No published correction/replacement policy for the bulk archive. ZIP CRC proves current-member bytes only, not historical immutability. Unknown vintage history. FAIL-UNKNOWN."
FX003-G06,current-byte / member integrity,PASS_PARTIAL,Yes,"FX003-R01B CRC-32 0x32280a6e = R03B central dir; comp 76401 / uncomp 201200 match","Member integrity verified: CRC-32, compressed and uncompressed sizes all match between central directory and inflated bytes. BUT complete-archive SHA-256 NOT captured (only a ranged member). Cannot assert whole-archive integrity. PASS-PARTIAL."
FX003-G07,internal acquisition / metadata-retention permission,FAIL,Yes,"FX003-R06B Kraken EE/A Terms; no redistribution clause","Bulk archive hosted on Google Drive (FX003-R05B). EE/A Terms reference Payward Commercial Ltd. and MiCA disclaimer but contain NO explicit bulk-data redistribution or API-commercial-use grant. Internal-research acquisition is plausible but licensing is ambiguous; fail-closed. FAIL."
FX003-G08,exact reproducible raw lineage,PASS_PARTIAL,Yes,"FX003-R01H/R02H/R03H/R04H content-range bytes + statuses","Member extracted via ranged GET with exact byte ranges and HTTP 206 + retained headers/bodies; reproducible for the member. Whole-archive byte-range/SHA not captured (ZIP64 offset=0xFFFFFFFF). Do NOT treat a ranged member as the complete archive SHA-256. PASS-PARTIAL."
